originalContent,correctedSentence,changes,temp_lower
"element x0, raised plotting pointbypoint ultimately yielded curve, shared necessarily assumptions","The element x0 is raised to the power of the plotting point-by-point, ultimately yielding a curve that shares the necessary assumptions.","<b> The </b> element <b> x0 is </b> raised <b> to the power of the </b> plotting <b> point-by-point, </b> ultimately <b> yielding a curve that shares the necessary assumptions. </b>","<b> the </b> element <b> x0 is </b> raised <b> to the power of the </b> plotting <b> point-by-point, </b> ultimately <b> yielding a curve that shares the necessary assumptions. </b>"
"3. converse, implication does Gaussian.","The converse is also true, and the implication is that the Gaussian distribution","<b> The converse is also true, and the </b> implication <b> is that the Gaussian distribution </b>","<b> the converse is also true, and the </b> implication <b> is that the gaussian distribution </b>"
"3 2. stronger prove 2, noted property GDA.","3 implies 2, and this is a stronger result. We prove 2, and note that this is a property of GDA.","3 <b> implies 2, and this is a </b> stronger <b> result. We </b> prove 2, <b> and note that this is a </b> property <b> of </b> GDA.","3 <b> implies 2, and this is a </b> stronger <b> result. we </b> prove 2, <b> and note that this is a </b> property <b> of </b> gda."
"correct, better regression.","This is correct, and better than regression.","<b> This is </b> correct, <b> and </b> better <b> than </b> regression.","<b> this is </b> correct, <b> and </b> better <b> than </b> regression."
"Specifically, indeed asymptotically efficient.","Specifically, it is indeed asymptotically efficient.","Specifically, <b> it is </b> indeed asymptotically efficient.","specifically, <b> it is </b> indeed asymptotically efficient."
"strong youre baking information algorithm, Informally, limit large sets m, there no strictly terms of, accurately","This is a strong result, and you're baking information into the algorithm. Informally, in the limit of large sets m, there is no strictly better algorithm in terms of accuracy.","<b> This is a </b> strong <b> result, and you're </b> baking information <b> into the algorithm. </b> Informally, <b> in the </b> limit <b> of </b> large sets m, there <b> is </b> no strictly <b> better algorithm in </b> terms <b> of accuracy. </b>","<b> this is a </b> strong <b> result, and you're </b> baking information <b> into the algorithm. </b> informally, <b> in the </b> limit <b> of </b> large sets m, there <b> is </b> no strictly <b> better algorithm in </b> terms <b> of accuracy. </b>"
