originalContent,correctedSentence,changes,temp_lower
"Back to Top CS229 Gaussian Discriminant Analysis Generative Learning Algorithms Weve mainly looked at learning algorithms that model Pyx, the conditional distribution of y given x.","Back to Top CS229 Gaussian Discriminant Analysis Generative Learning Algorithms We've mainly looked at learning algorithms that model Pyx, the conditional distribution of y given x.","Back to Top CS229 Gaussian Discriminant Analysis Generative Learning Algorithms <b> We've </b> mainly looked at learning algorithms that model Pyx, the conditional distribution of y given x.","back to top cs229 gaussian discriminant analysis generative learning algorithms <b> we've </b> mainly looked at learning algorithms that model pyx, the conditional distribution of y given x."
"For instance, logistic regression modeled Pyx as hxgTx where g is sigmoid function.","For instance, logistic regression modelled Pyx as hxgTx where g is sigmoid function.","For instance, logistic regression <b> modelled </b> Pyx as hxgTx where g is sigmoid function.","for instance, logistic regression <b> modelled </b> pyx as hxgtx where g is sigmoid function."
"In this section, well talk about a different type algorithm.","In this section, we'll talk about a different type of algorithm.","In this section, <b> we'll </b> talk about a different type <b> of </b> algorithm.","in this section, <b> we'll </b> talk about a different type <b> of </b> algorithm."
Lets use binary classification problem motivation behind our discussion.,Let's use binary classification problem motivation behind our discussion.,<b> Let's </b> use binary classification problem motivation behind our discussion.,<b> let's </b> use binary classification problem motivation behind our discussion.
Consider in which we want learn distinguish between malignant y1 and benign y0 tumors.,Consider in which we want to learn to distinguish between malignant y1 and benign y0 tumours.,Consider in which we want <b> to </b> learn <b> to </b> distinguish between malignant y1 and benign y0 <b> tumours. </b>,consider in which we want <b> to </b> learn <b> to </b> distinguish between malignant y1 and benign y0 <b> tumours. </b>
"Given training set, an algorithm like , or initially starts with randomly initialized parameters.","Given a training set, an algorithm like , or initially starts with randomly initialised parameters.","Given <b> a </b> training set, an algorithm like , or initially starts with randomly <b> initialised </b> parameters.","given <b> a </b> training set, an algorithm like , or initially starts with randomly <b> initialised </b> parameters."
"Over course learning, performs gradient descent straight line hyperplane decision boundary evolves until you obtain separates positivenegative examples case, Then, classify new sample either benign, it checks on side falls in, makes its prediction accordingly.","Over the course of learning, it performs gradient descent on a straight line hyperplane decision boundary, which evolves until it separates positive and negative examples. Then, it classifies a new sample as either benign or malignant, depending on which side it falls in, and makes its prediction accordingly.","Over <b> the </b> course <b> of </b> learning, <b> it </b> performs gradient descent <b> on a </b> straight line hyperplane decision <b> boundary, which </b> evolves until <b> it </b> separates <b> positive and negative examples. </b> Then, <b> it classifies a </b> new sample <b> as </b> either <b> benign or malignant, depending on which side </b> it falls in, <b> and </b> makes its prediction accordingly.","over <b> the </b> course <b> of </b> learning, <b> it </b> performs gradient descent <b> on a </b> straight line hyperplane decision <b> boundary, which </b> evolves until <b> it </b> separates <b> positive and negative examples. </b> then, <b> it classifies a </b> new sample <b> as </b> either <b> benign or malignant, depending on which side </b> it falls in, <b> and </b> makes its prediction accordingly."
Theres class arent trying maximize likelihood looking both classes searching for separation boundary.,"There's a class that aren't trying to maximise likelihood, looking at both classes and searching for a separation boundary.","<b> There's a </b> class <b> that aren't </b> trying <b> to maximise likelihood, </b> looking <b> at </b> both classes <b> and </b> searching for <b> a </b> separation boundary.","<b> there's a </b> class <b> that aren't </b> trying <b> to maximise likelihood, </b> looking <b> at </b> both classes <b> and </b> searching for <b> a </b> separation boundary."
"Instead, these look one time.","Instead, these look at one time.","Instead, these look <b> at </b> one time.","instead, these look <b> at </b> one time."
"First, tumors, can features what tumors like.","First, tumours can have features that are like other tumours.","First, <b> tumours </b> can <b> have </b> features <b> that are like other tumours. </b>","first, <b> tumours </b> can <b> have </b> features <b> that are like other tumours. </b>"
"build separate Finally, tumor, match against tumor model, see whether looks more had seen set.","Build separate models for each tumour type. Finally, match the tumour against the tumour model, and see whether it looks more like the tumours in the training set.","<b> Build </b> separate <b> models for each tumour type. </b> Finally, match <b> the tumour </b> against <b> the tumour </b> model, <b> and </b> see whether <b> it </b> looks more <b> like the tumours in the training </b> set.","<b> build </b> separate <b> models for each tumour type. </b> finally, match <b> the tumour </b> against <b> the tumour </b> model, <b> and </b> see whether <b> it </b> looks more <b> like the tumours in the training </b> set."
try directly such mapping from input space X labels are called discriminative algorithms.,"Try to directly map from the input space X to the labels, which are called discriminative algorithms.","<b> Try to </b> directly <b> map </b> from <b> the </b> input space X <b> to the labels, which </b> are called discriminative algorithms.","<b> try to </b> directly <b> map </b> from <b> the </b> input space x <b> to the labels, which </b> are called discriminative algorithms."
instead Pxy Py.,"Instead, Pxy = Py.","<b> Instead, </b> Pxy <b> = </b> Py.","<b> instead, </b> pxy <b> = </b> py."
"These generative if indicates example 0 1, then Pxy0 models features, while Pxy1 features.","These generative models indicate that, for example, Pxy0 models the features of class 0, while Pxy1 models the features of class 1.","These generative <b> models indicate that, for example, </b> Pxy0 models <b> the features of class 0, </b> while Pxy1 <b> models the features of class 1. </b>","these generative <b> models indicate that, for example, </b> pxy0 models <b> the features of class 0, </b> while pxy1 <b> models the features of class 1. </b>"
The also learns prior Py independent probability y.,"The model also learns the prior probability Py, which is independent of y.","The <b> model </b> also learns <b> the </b> prior <b> probability Py, which is </b> independent <b> of </b> y.","the <b> model </b> also learns <b> the </b> prior <b> probability py, which is </b> independent <b> of </b> y."
"To illustrate concept using practical when patient walks into hospital, before doctors even them, odds their versus referred prior.","To illustrate this concept, consider a practical example: when a patient walks into a hospital, before the doctors even see them, the odds of their having a particular disease versus not having it are referred to as the prior probability.","To illustrate <b> this concept, consider a </b> practical <b> example: </b> when <b> a </b> patient walks into <b> a </b> hospital, before <b> the </b> doctors even <b> see </b> them, <b> the </b> odds <b> of </b> their <b> having a particular disease </b> versus <b> not having it are </b> referred <b> to as the prior probability. </b>","to illustrate <b> this concept, consider a </b> practical <b> example: </b> when <b> a </b> patient walks into <b> a </b> hospital, before <b> the </b> doctors even <b> see </b> them, <b> the </b> odds <b> of </b> their <b> having a particular disease </b> versus <b> not having it are </b> referred <b> to as the prior probability. </b>"
"Thus, builds each isolation.","Thus, the model builds each in isolation.","Thus, <b> the model </b> builds each <b> in </b> isolation.","thus, <b> the model </b> builds each <b> in </b> isolation."
"At test time, evaluates models, identifies matches most closely returns prediction.","At test time, the model evaluates the models, identifies which one matches most closely, and returns the prediction.","At test time, <b> the model </b> evaluates <b> the </b> models, identifies <b> which one </b> matches most <b> closely, and </b> returns <b> the </b> prediction.","at test time, <b> the model </b> evaluates <b> the </b> models, identifies <b> which one </b> matches most <b> closely, and </b> returns <b> the </b> prediction."
"After modeling priors Pxy, Bayes rule derive posterior x PyxPxyPyPx","After modelling the priors Pxy, we can derive the posterior probability x using Bayes' rule: Pyx = PxyPyPx","After <b> modelling the </b> priors Pxy, <b> we can </b> derive <b> the </b> posterior <b> probability </b> x <b> using Bayes' rule: Pyx = PxyPyPx </b>","after <b> modelling the </b> priors pxy, <b> we can </b> derive <b> the </b> posterior <b> probability </b> x <b> using bayes' rule: pyx = pxypypx </b>"
"Here, denominator by PxPxy1Py1Pxy0Py0, function quantities","Here, the denominator is given by Px = Pxy1Py1 + Pxy0Py0, which is a function of the quantities","Here, <b> the </b> denominator <b> is given </b> by <b> Px = Pxy1Py1 + Pxy0Py0, which is a </b> function <b> of the </b> quantities","here, <b> the </b> denominator <b> is given </b> by <b> px = pxy1py1 + pxy0py0, which is a </b> function <b> of the </b> quantities"
"Note learned part process calculating order make prediction, dont actually need calculate value Px since constant, doesnt appear there.","Note that the learned part of the process is calculating the order to make a prediction, but we don't actually need to calculate the value of Px since it is a constant and doesn't appear in the final prediction.","Note <b> that the </b> learned part <b> of the </b> process <b> is </b> calculating <b> the </b> order <b> to </b> make <b> a </b> prediction, <b> but we don't </b> actually need <b> to </b> calculate <b> the </b> value <b> of </b> Px since <b> it is a constant and doesn't </b> appear <b> in the final prediction. </b>","note <b> that the </b> learned part <b> of the </b> process <b> is </b> calculating <b> the </b> order <b> to </b> make <b> a </b> prediction, <b> but we don't </b> actually need <b> to </b> calculate <b> the </b> value <b> of </b> px since <b> it is a constant and doesn't </b> appear <b> in the final prediction. </b>"
"When making predictions algorithms, thus ignore computing save computation.","When making predictions, algorithms thus ignore computing Px to save computation.","When making <b> predictions, algorithms </b> thus ignore computing <b> Px to </b> save computation.","when making <b> predictions, algorithms </b> thus ignore computing <b> px to </b> save computation."
"However, end goal value, would compute be able normalize numerator.","However, the end goal is to compute the value of Px, which would allow us to normalise the numerator.","However, <b> the </b> end goal <b> is to compute the value of Px, which </b> would <b> allow us to normalise the </b> numerator.","however, <b> the </b> end goal <b> is to compute the value of px, which </b> would <b> allow us to normalise the </b> numerator."
PyxPxyPyPxPxyPy above equation represents underlying framework .,The equation Pyx = PxyPyPx represents the underlying framework.,<b> The </b> equation <b> Pyx = PxyPyPx </b> represents <b> the </b> underlying <b> framework. </b>,<b> the </b> equation <b> pyx = pxypypx </b> represents <b> the </b> underlying <b> framework. </b>
"Key takeaways Discriminative i.e., output input.","Key takeaways: discriminative models, i.e., output is a function of input.","Key <b> takeaways: discriminative models, </b> i.e., output <b> is a function of </b> input.","key <b> takeaways: discriminative models, </b> i.e., output <b> is a function of </b> input."
"other words, hx0,1 directly.","In other words, hx is 0 or 1 directly.","<b> In </b> other words, <b> hx is 0 or 1 </b> directly.","<b> in </b> other words, <b> hx is 0 or 1 </b> directly."
"class, tumoridentification setting, may case them first discriminant analysis GDA, used continuousvalued say, classification.","In the case of tumour identification, we may use discriminant analysis (GDA) for continuous-valued classification.","<b> In the case of tumour identification, we </b> may <b> use </b> discriminant analysis <b> (GDA) for continuous-valued </b> classification.","<b> in the case of tumour identification, we </b> may <b> use </b> discriminant analysis <b> (gda) for continuous-valued </b> classification."
assume distributed according multivariate normal distribution.,We assume that the data is distributed according to a multivariate normal distribution.,<b> We </b> assume <b> that the data is </b> distributed according <b> to a </b> multivariate normal distribution.,<b> we </b> assume <b> that the data is </b> distributed according <b> to a </b> multivariate normal distribution.
briefly properties distributions moving GDA itself.,We will briefly discuss the properties of the distributions and then move on to GDA itself.,<b> We will </b> briefly <b> discuss the </b> properties <b> of the </b> distributions <b> and then move on to </b> GDA itself.,<b> we will </b> briefly <b> discuss the </b> properties <b> of the </b> distributions <b> and then move on to </b> gda itself.
"Multivariate Distribution generalization 1dimensional random variable ndimensional simply, nrandom variable.",A multivariate distribution is a generalisation of a 1-dimensional random variable to an n-dimensional random variable.,<b> A multivariate distribution is a generalisation of a 1-dimensional </b> random variable <b> to an n-dimensional random </b> variable.,<b> a multivariate distribution is a generalisation of a 1-dimensional </b> random variable <b> to an n-dimensional random </b> variable.
"rather than univariate variable, seeks multiple variables.","Rather than a univariate variable, it seeks multiple variables.","<b> Rather </b> than <b> a </b> univariate variable, <b> it </b> seeks multiple variables.","<b> rather </b> than <b> a </b> univariate variable, <b> it </b> seeks multiple variables."
"Assume Gaussian, i.e, XRn, parameterized mean vector Rn covariance matrix Rnn, symmetric positive semidefinite.","We assume that the data is Gaussian, i.e., X ~ Rn, parameterised by a mean vector in Rn and a covariance matrix in Rnn, which is symmetric and positive semidefinite.","<b> We assume that the data is </b> Gaussian, <b> i.e., X ~ Rn, parameterised by a </b> mean vector <b> in </b> Rn <b> and a </b> covariance matrix <b> in </b> Rnn, <b> which is </b> symmetric <b> and </b> positive semidefinite.","<b> we assume that the data is </b> gaussian, <b> i.e., x ~ rn, parameterised by a </b> mean vector <b> in </b> rn <b> and a </b> covariance matrix <b> in </b> rnn, <b> which is </b> symmetric <b> and </b> positive semidefinite."
"Formally, written as, XN, density PDF PX,12n212exp12XT1X denotes determinant expected ExxPx,dx vectorvalued defined CovX EXET.","Formally, this can be written as X ~ N(μ, Σ), where the density PDF is given by PX(x) = (1/√(2π)^n) * exp(-1/2 * (x-μ)^T * Σ^(-1) * (x-μ)), where μ is the mean vector, Σ is the covariance matrix, and E[x] is the expected value of x.","Formally, <b> this can be </b> written <b> as X ~ N(μ, Σ), where the </b> density PDF <b> is given by PX(x) = (1/√(2π)^n) * exp(-1/2 * (x-μ)^T * Σ^(-1) * (x-μ)), where μ is the mean vector, Σ is the covariance matrix, and E[x] is the </b> expected <b> value of x. </b>","formally, <b> this can be </b> written <b> as x ~ n(μ, σ), where the </b> density pdf <b> is given by px(x) = (1/√(2π)^n) * exp(-1/2 * (x-μ)^t * σ^(-1) * (x-μ)), where μ is the mean vector, σ is the covariance matrix, and e[x] is the </b> expected <b> value of x. </b>"
Covariance generalizes notion variance realvalued setting.,Covariance generalises the notion of variance in the real-valued setting.,Covariance <b> generalises the </b> notion <b> of </b> variance <b> in the real-valued </b> setting.,covariance <b> generalises the </b> notion <b> of </b> variance <b> in the real-valued </b> setting.
EEET.,E[E^T] = E[E]E^T.,<b> E[E^T] = E[E]E^T. </b>,<b> e[e^t] = e[e]e^t. </b>
Since CovX.,"Since Cov(X) = E[(X-E[X])(X-E[X])^T],","Since <b> Cov(X) = E[(X-E[X])(X-E[X])^T], </b>","since <b> cov(x) = e[(x-e[x])(x-e[x])^t], </b>"
explore some visualize Recall familiar,Let's explore some visualisations. Recall the familiar,<b> Let's </b> explore some <b> visualisations. </b> Recall <b> the </b> familiar,<b> let's </b> explore some <b> visualisations. </b> recall <b> the </b> familiar
"Similarly, multivariable represented same bellshaped curve two parameters control PDF, but ndimensions.","Similarly, a multivariate distribution can be represented by the same bell-shaped curve, but with two parameters controlling the PDF in n dimensions.","Similarly, <b> a multivariate distribution can be </b> represented <b> by the </b> same <b> bell-shaped curve, but with </b> two parameters <b> controlling the PDF in n dimensions. </b>","similarly, <b> a multivariate distribution can be </b> represented <b> by the </b> same <b> bell-shaped curve, but with </b> two parameters <b> controlling the pdf in n dimensions. </b>"
"e.g., 2dimensional over 2 variables, 2dimensional, size 22.","For example, a 2-dimensional distribution over 2 variables has a size of 2x2.","<b> For example, a 2-dimensional distribution </b> over 2 <b> variables has a </b> size <b> of 2x2. </b>","<b> for example, a 2-dimensional distribution </b> over 2 <b> variables has a </b> size <b> of 2x2. </b>"
below figure shows zero 21 zerovector I 22 identity matrix.,"The figure below shows a zero-mean vector, a 2x1 zero vector, and a 2x2 identity matrix.","<b> The figure </b> below shows <b> a zero-mean vector, a 2x1 </b> zero <b> vector, and a 2x2 </b> identity matrix.","<b> the figure </b> below shows <b> a zero-mean vector, a 2x1 </b> zero <b> vector, and a 2x2 </b> identity matrix."
A standard 0.6I.,A standard deviation of 0.6I.,A standard <b> deviation of </b> 0.6I.,a standard <b> deviation of </b> 0.6i.
"essentially taken multiplied number has shrunk variance, reduced variability 2I.","Essentially, the number has been multiplied by 0.6, which has shrunk the variance and reduced the variability. 2I.","<b> Essentially, the </b> number has <b> been multiplied by 0.6, which has </b> shrunk <b> the variance and </b> reduced <b> the variability. </b> 2I.","<b> essentially, the </b> number has <b> been multiplied by 0.6, which has </b> shrunk <b> the variance and </b> reduced <b> the variability. </b> 2i."
"From images, becomes larger, widershorter, smaller, compressedtaller.","From the images, we can see that as the covariance matrix becomes larger, the distribution becomes wider and shorter, and as it becomes smaller, the distribution becomes compressed and taller.","From <b> the </b> images, <b> we can see that as the covariance matrix </b> becomes larger, <b> the distribution becomes wider and shorter, and as it becomes </b> smaller, <b> the distribution becomes compressed and taller. </b>","from <b> the </b> images, <b> we can see that as the covariance matrix </b> becomes larger, <b> the distribution becomes wider and shorter, and as it becomes </b> smaller, <b> the distribution becomes compressed and taller. </b>"
"This because always integrates area under so scales spread vs. height figures show Gaussians corresponding matrices figures, increase offdiagonal entries compressed towards 45 x1x2.","This is because the area under the curve always integrates to 1, so as the spread increases, the height decreases, and vice versa. The figures show Gaussians corresponding to the matrices, and as the off-diagonal entries increase, the distribution becomes compressed towards the 45° line between x1 and x2.","This <b> is </b> because <b> the area under the curve </b> always integrates <b> to 1, </b> so <b> as the </b> spread <b> increases, the </b> height <b> decreases, and vice versa. The </b> figures show Gaussians corresponding <b> to the matrices, and as the off-diagonal </b> entries <b> increase, the distribution becomes </b> compressed towards <b> the 45° line between x1 and x2. </b>","this <b> is </b> because <b> the area under the curve </b> always integrates <b> to 1, </b> so <b> as the </b> spread <b> increases, the </b> height <b> decreases, and vice versa. the </b> figures show gaussians corresponding <b> to the matrices, and as the off-diagonal </b> entries <b> increase, the distribution becomes </b> compressed towards <b> the 45° line between x1 and x2. </b>"
"Geometrically speaking, implies variables positively correlated.","Geometrically speaking, this implies that the variables are positively correlated.","Geometrically speaking, <b> this </b> implies <b> that the </b> variables <b> are </b> positively correlated.","geometrically speaking, <b> this </b> implies <b> that the </b> variables <b> are </b> positively correlated."
"We clearly contours three densities 3D bumps saw above, should perfectly round circles, aspect ratio image probably little bit fatter places being","We can clearly see the contours of the three densities, which are 3D bumps. The aspect ratio of the image is probably a little bit fatter in some places, but the contours should be perfectly round circles.","We <b> can </b> clearly <b> see the </b> contours <b> of the </b> three <b> densities, which are </b> 3D <b> bumps. The </b> aspect ratio <b> of the </b> image <b> is </b> probably <b> a </b> little bit fatter <b> in some places, but the contours should be perfectly round circles. </b>","we <b> can </b> clearly <b> see the </b> contours <b> of the </b> three <b> densities, which are </b> 3d <b> bumps. the </b> aspect ratio <b> of the </b> image <b> is </b> probably <b> a </b> little bit fatter <b> in some places, but the contours should be perfectly round circles. </b>"
"Heres another set along decreasing elements matrix, now again, opposite direction, 135 line.","Here's another set of images, this time with decreasing elements of the matrix, and again, in the opposite direction, along the 135° line.","<b> Here's </b> another set <b> of images, this time with </b> decreasing elements <b> of the </b> matrix, <b> and </b> again, <b> in the </b> opposite direction, <b> along the 135° </b> line.","<b> here's </b> another set <b> of images, this time with </b> decreasing elements <b> of the </b> matrix, <b> and </b> again, <b> in the </b> opposite direction, <b> along the 135° </b> line."
"Again, geometrically, endow negative correlation.","Again, geometrically, this endows the variables with a negative correlation.","Again, geometrically, <b> this endows the variables with a </b> negative correlation.","again, geometrically, <b> this endows the variables with a </b> negative correlation."
"vary parameters, tend form ellipses.","As we vary the parameters, the distribution tends to form ellipses.","<b> As we </b> vary <b> the </b> parameters, <b> the distribution tends to </b> form ellipses.","<b> as we </b> vary <b> the </b> parameters, <b> the distribution tends to </b> form ellipses."
By varying shift center around.,By varying the shift of the center around.,By varying <b> the </b> shift <b> of the </b> center around.,by varying <b> the </b> shift <b> of the </b> center around.
"Another values I, visualization PDFs follows carry out eigenvectors points principal axes ellipse contours.",Another way to visualise the PDFs is to carry out the eigenvectors and points of the principal axes of the ellipse contours.,Another <b> way to visualise the </b> PDFs <b> is to </b> carry out <b> the </b> eigenvectors <b> and </b> points <b> of the </b> principal axes <b> of the </b> ellipse contours.,another <b> way to visualise the </b> pdfs <b> is to </b> carry out <b> the </b> eigenvectors <b> and </b> points <b> of the </b> principal axes <b> of the </b> ellipse contours.
"takeaway As density, change spreadheight respectively.","The takeaway is that as the density changes, the spread and height change respectively.","<b> The </b> takeaway <b> is that as the density changes, the spread and height </b> change respectively.","<b> the </b> takeaway <b> is that as the density changes, the spread and height </b> change respectively."
"Model have consider task discussion, expressed equations Pxy1, Gaussians.","The model we have been considering for this task is expressed in terms of equations for Pxy1, which are Gaussians.","<b> The model we </b> have <b> been considering for this </b> task <b> is </b> expressed <b> in terms of </b> equations <b> for </b> Pxy1, <b> which are </b> Gaussians.","<b> the model we </b> have <b> been considering for this </b> task <b> is </b> expressed <b> in terms of </b> equations <b> for </b> pxy1, <b> which are </b> gaussians."
"On hand, Bernoulli takes 0,1.","On the other hand, the Bernoulli distribution takes values 0 and 1.","On <b> the other </b> hand, <b> the </b> Bernoulli <b> distribution </b> takes <b> values 0 and 1. </b>","on <b> the other </b> hand, <b> the </b> bernoulli <b> distribution </b> takes <b> values 0 and 1. </b>"
